Numero,objectid,object_location,title,creator,date,description,subject,source,type,display_template,language,identifier,rights,rightsstatement,parentid,image_small,image_thumb,format,object_transcript
385.1,voz_385_1,https://www.dropbox.com/scl/fi/cbleauk2w285ixr6b0d5h/voz_385_1.pdf?rlkey=in5c60r850gr40pyodl8k0y50&st=utcg54ut&raw=1,¿Qué es la misteriosa promoción popular?,"Cáceres C., Leonardo",1964-12-20,"Cuando el presidente Eduardo Frei firmó el proyecto de ley sobre la ""Promoción Popular"" , en el comedor de gala del Palacio de la Moneda, frente a él se encontraban poco más de doscientos dirigentes sindicales de juntas de vecinos, de pobladores y centros comunales. Poco antes, Frei había pronunciado un discurso de 40 minutos, en el cual explicó detalladamente en que consiste la Promoción Popular.",Eduardo Frei; Promoción Popular,"Revista la voz, Colecciones Especiales Biblioteca de Humanidades Universidad Catolica de Chile",application/pdf,pdf,spa,385  20-12-1964,Educational use permitted,http://rightsstatements.org/vocab/InC-EDU/1.0/,,/objects/small/385.1_sm.jpg,/objects/thumbs/385.1_th.jpg,application/pdf,/objects/transcripciones/voz_385_1t.md
385 portada,voz_385_p,https://www.dropbox.com/scl/fi/lm20ys1zhmus56xy9frrp/385.portada.jpg?rlkey=knefpdaj7jygf9xop4jqwgr5n&st=ik2utv09&raw=1,Diario la voz N°385 20 de dicimebre de 1964,"Santibañes., Abraham",1964-12-20,,,"Revista la voz, Colecciones Especiales Biblioteca de Humanidades Universidad Catolica de Chile",,image,spa,385  20-12-1964,Educational use permitted,http://rightsstatements.org/vocab/InC-EDU/1.0/,,/objects/small/385.portada_sm.jpg,/objects/thumbs/385.portada_th.jpg,Image,
385.3,voz_385_3,https://www.dropbox.com/scl/fi/5yaee9bh3usamukg5vlln/voz_385_2.pdf?rlkey=3jdfjmq9yrk8gewog9xqgcq5v&st=872r5ezr&raw=1,Comenzó el Vía Crucis de las Reformas ,"Cáceres C., Leonardo",1964-12-20,"Era de esperar que los dos puntos más controvertidos de las reformas constitucionales propuestas por el actual Jefe del Estado serían el plebiscito y el derecho de propiedad. El miércoles 16 comenzó la discusión parlamentaria, con una exposición del Ministro de Justicia, Pedro Jesús Rodríguez, en la Comisión respectiva de la Cámara de Diputados.",Reformas constitucionales; Ministro de Justicia,"Revista la voz, Colecciones Especiales Biblioteca de Humanidades Universidad Catolica de Chile",application/pdf,pdf,spa,385 20-12-1964,Educational use permitted,http://rightsstatements.org/vocab/InC-EDU/1.0/,,/objects/small/385.3_sm.jpg,/objects/thumbs/385.3_th.jpg,application/pdf,
384 portada,voz_384_p,https://www.dropbox.com/scl/fi/87ifuzghz0nmtgpk1hjtt/384.portada.jpg?rlkey=qde0w6n68v3grzff37dudeu5h&st=vdzs9rsb&raw=1,Diario la voz N°384 13 de diciembre de 1964,"Santibañes., Abraham",1964-12-13,,Concilio Vaticano II ; Hospitales ; Reforma habitacional,"Revista la voz, Colecciones Especiales Biblioteca de Humanidades Universidad Catolica de Chile",Image;StillImage,image,spa,384  13-12-1964,Educational use permitted,http://rightsstatements.org/vocab/InC-EDU/1.0/,,/objects/small/384.portada_sm.jpg,/objects/thumbs/384.portada_th.jpg,Image;StillImage,
384.1,voz_384_1,https://www.dropbox.com/scl/fi/t3um2syickuepol32g8k6/voz_384_1.pdf?rlkey=3halb0d4xzzz4ollikznnfl4d&st=dxgjy0g0&raw=1,Como fui destituido,"Cruzat Paul, Gastón",1964-12-13,"El día 12 de octubre de este año estallo en Roma una especie de bomba, El Concilio Vaticano II atravesaba por una delicada crisis con motivo de ciertos obstáculos que hacían peligrar algunos esquemas y declaraciones importantes. Desde varios días atrás, circulaban rumores de malestar, pero hasta ese momento no se había logrado precisar su causa. Le tocó al desconocido Centro Latinoamericano de Información - Dirigido por quien escribe esta crónica- dar a conocer los hechos, mediante un boletín entregado a las principales agencias noticiosas internacionales. Poco después, los diarios de todo el mundo y las radios europeas se encargaban de difundir el comunicado, que dio la información en forma exclusiva. ¿ Que había sucedido?",Concilio Vaticano II,"Revista la voz, Colecciones Especiales Biblioteca de Humanidades Universidad Catolica de Chile",application/pdf,pdf,spa,384 13-12-1964,Educational use permitted,http://rightsstatements.org/vocab/InC-EDU/1.0/,,/objects/small/384.1_sm.jpg,/objects/thumbs/384.1_th.jpg,application/pdf,
384.2,voz_384_2,https://www.dropbox.com/scl/fi/8l870arehil2oq9dsp1f9/voz_384_2.pdf?rlkey=bsaoejka0yeohx3giaqrz8n4k&st=zi0c1ubf&raw=1,Reformas Constitucionales: Fuego graneado en varios frentes,"Cáceres C., Leonardo",1964-12-13,"Por primera vez, desde el triunfo de la Revolución Cubana, un Jefe de Gabinete latinoamericano desafío abiertamente al Primer Ministro Fidel Castro a que compitieran y observaran, en cada país como se desenvuelven sus respectivos regímenes. Fue el Ministro del Interior de Chile Bernardo Leighton, que conversando con los periodistas el viernes 4,dijo : Yo invitaría al señor Castro a visitar Chile para que conozca nuestra Revolución en Libertad, siempre que a mí me permita ir a La Habana y decir allí las verdades que los cubanos no conocen.",,"Revista la voz, Colecciones Especiales Biblioteca de Humanidades Universidad Catolica de Chile",application/pdf,pdf,spa,384 13-12-1964,Educational use permitted,http://rightsstatements.org/vocab/InC-EDU/1.0/,,/objects/small/384.2_sm.jpg,/objects/thumbs/384.2_th.jpg,application/pdf,
384.3,voz_384_3,https://www.dropbox.com/scl/fi/g72rrkb5o74e3e45rgkfo/voz_384_3.pdf?rlkey=fc0r24kic0txhwyzcmjuxhl3l&st=98ror63j&raw=1,El Hospital: Condena a Muerte,"Allendes, María Cecilia ; Mazzola, Marina",1964-12-13,"Vuelva otro día. Ya no es hora, dice una voz detrás de la puerta que se cierra, como una imagen de la burocracia. La mujer parte con su hijo, inconsciente, en brazos. Mañana será hora, pero talvez sea tarde... Y tal vez sea tarde para el hombre que necesita una radiografía y debe esperar que su solicitud siga su curso... Y para el anciano que se equivocó de hospital y fue al de otra área. ( Pero ¿ qué es área?. El esa enfermo, necesita atención, su dolencia no sabe de áreas). En unas partes, colas; en otra, una camilla pasa por el patio, y de ella cuelgan los brazos de un cadáver. Operaciones urgentes no pueden hacerse porque faltan agujas, hilo... ¡sábanas! ¿ Que ocurre en los hospitales Chilenos.?",Hospitales; Salud,"Revista la voz, Colecciones Especiales Biblioteca de Humanidades Universidad Catolica de Chile",application/pdf,pdf,spa,384 13-12-1964,Educational use permitted,http://rightsstatements.org/vocab/InC-EDU/1.0/,,/objects/small/384.3_sm.jpg,/objects/thumbs/384.3_th.jpg,application/pdf,
231 portada,voz_231_p,https://www.dropbox.com/scl/fi/s9rdn2bp9lrb6nwv1kwa1/231.1A.jpg?rlkey=8htulmmmo129vt39bo6eyh16b&st=1ogqmayz&raw=1,Diario la voz N°231 07 de enero de 1962,"Santibañes., Abraham",1962-01-07,,Sociedad; dinero; cultura; ciencia; poder ,"Revista la voz, Colecciones Especiales Biblioteca de Humanidades Universidad Catolica de Chile",Image;StillImage,image,spa,231  07-01-1962,Educational use permitted,http://rightsstatements.org/vocab/InC-EDU/1.0/,,/objects/small/231.portada_sm.jpg,/objects/thumbs/231.portada_th.jpg,Image;StillImage,
"231.1
",voz_231_1,https://www.dropbox.com/scl/fi/j4qxtzislutgw4svmt832/voz_231_1.pdf?rlkey=gytrg0wcifxkyg2mzssfpuq82&st=fofk825n&raw=1,"""Picassos"" de preparatorias","Baltra, Lidia",1962-01-07,"Un joven pintor moderno está revolucionando las clases de dibujos infantiles en un colegio santiaguino. En diciembre, durante las fiestas y presentaciones de fin de año del establecimiento, asombró a entendidos en pintura moderna presentando verdaderos ""Picassos ... dibujados por niños de primera preparatoria. Adolfo Couve es artista de la galería Carmen Waugh, con dos exhibiciones de sus obras en Santiago, y una en la Galería Internacional de Madison Avenue, en Nueva York, hace dos años ",Picassos; Santiago; Nueva York,"Revista la voz, Colecciones Especiales Biblioteca de Humanidades Universidad Catolica de Chile",application/pdf,pdf,spa,231  07-01-1962,Educational use permitted,http://rightsstatements.org/vocab/InC-EDU/1.0/,,/objects/small/231.1_sm.jpg,/objects/thumbs/231.1_th.jpg,application/pdf,
"231.2
",voz_231_2,https://www.dropbox.com/scl/fi/udjb81zxmy72jzqnapfwe/voz_231_2.pdf?rlkey=mnnytss6niuakehkqnwpwtl8o&st=cilvus6e&raw=1,El terremoto del dolar,"Rojas, Darío ",1962-01-07,"Un terremoto económico-político a causado el dolar en Chile. El movimiento comenzó a fines de noviembre y adquirió su más recia intesidad  en los últimos ocho días del año. Los más directamente afectados fueron los puertos libres y la administración del Presidente Alessandri: los primeros, porque medidas limitativas de su comercio ilimitado han sido propuestas, y la segunda porque se ha producido una coyuntura que es favorable para la posición opositora.",Chile; dolar; Alessandri,"Revista la voz, Colecciones Especiales Biblioteca de Humanidades Universidad Catolica de Chile",application/pdf,pdf,spa,231  07-01-1962,Educational use permitted,http://rightsstatements.org/vocab/InC-EDU/1.0/,,/objects/small/231.2_sm.jpg,/objects/thumbs/231.2_th.jpg,application/pdf,
234 portada,voz_234_p,https://www.dropbox.com/scl/fi/imv8xogvn4i5ap4gnucbg/234-P.jpg?rlkey=d7f95132x6qxhi17q8j3y538p&st=8ilphgaj&raw=1,Diario la voz N°234 28 de enero de 1962,"Santibañes., Abraham",1962-01-28,,Sociedad; dinero; cultura; ciencia; poder ,"Revista la voz, Colecciones Especiales Biblioteca de Humanidades Universidad Catolica de Chile",Image;StillImage,image,spa,234  28-01-1962,Educational use permitted,http://rightsstatements.org/vocab/InC-EDU/1.0/,,/objects/small/234 p_sm.jpg,/objects/thumbs/234 p_th.jpg,Image;StillImage,
"234.1
",voz_234_1,https://www.dropbox.com/scl/fi/8m7yr7f1fi6g6eurbo3se/234.1.pdf?rlkey=irpvb7iga9qt5v1233ryebvtm&st=33mnycqr&raw=1,"VII escuela de verano penquista: Mas que estudio politica ""al rojo""","Baltra, Lidia",1962-01-28,"De ""tinte rojizo"" se calificó en todos los círculos a la escuela de verano de la Universidad de Concepción, que comenzó al lunes 15 con el ciclo ""Imagen de América Latina"" y termina esta semana con ""Imagen del hombre"". Un catedrático norteamericano se retiró antes de tiempo y con una conferencia sobre las excelencias de la Cuba actual se cerró el ciclo sobre Latinoámerica. El tabloide ""La crónica"" tituló en primera página: ""Temperatura la rojo en la escuela de verano""",Chile; dolar; AlessandriRojizo; Universidad de Concepción; América Latina; Cuba,"Revista la voz, Colecciones Especiales Biblioteca de Humanidades Universidad Catolica de Chile",application/pdf,pdf,spa,234  28-01-1962,Educational use permitted,http://rightsstatements.org/vocab/InC-EDU/1.0/,,/objects/small/234.1_sm.jpg,/objects/small/234.1_sm.jpg,application/pdf,/objects/transcripciones/234. 1 T.md
"234.2
",voz_234_2,https://www.dropbox.com/scl/fi/dyz1o3rugqffmwm399g6t/234.2.pdf?rlkey=578kif7ipcnpckz3ijuuq738h&st=ozfi5tfn&raw=1,El veraneo,"
Santibáñez, Abraham",1962-01-28,"Cuántos son, nadie lo sabe con exactud. Su aspecto, su condición económica y social son como un arco iris. Viejos, algunos nostálgicos, jóvenes alegres, tranquilas señoras e inquietos niños. Visten de mil formas diferentes, comen desde apetitosos sandiwichs caseros hasta aristocráticas langostas thermidor.  Y duermen...donde pueden...",Viejos; aristocráticas; themidor,"Revista la voz, Colecciones Especiales Biblioteca de Humanidades Universidad Catolica de Chile",application/pdf,pdf,spa,234  28-01-1962,Educational use permitted,http://rightsstatements.org/vocab/InC-EDU/1.0/,,/objects/small/234.2_sm.jpg,/objects/small/234.2_sm.jpg,application/pdf,/objects/transcripciones/234.2 T.md
"234.3
",voz_234_3,https://www.dropbox.com/scl/fi/13obsfd67t8no5qlkd3fe/234.3.pdf?rlkey=qfcy798icmywu8xblp7bpzqgx&st=y0vfi3ur&raw=1,¿Porque hablan las generaciones? Los viejos por egoismo los jovenes por amor ,RESSKA,1962-01-28,"Los padres de vieja escuela no comprenden lo que, sin romanticismo, se puede lla",vejez,"Revista la voz, Colecciones Especiales Biblioteca de Humanidades Universidad Catolica de Chile",application/pdf,pdf,spa,234  28-01-1962,Educational use permitted,http://rightsstatements.org/vocab/InC-EDU/1.0/,,/objects/small/234.3_sm.jpg,/objects/small/234.3_sm.jpg,application/pdf,/objects/transcripciones/234.3t.md
"234.4
",voz_234_4,https://www.dropbox.com/scl/fi/ivxxv1zsanolcqh17yt5v/234.4.pdf?rlkey=auufhez2lcanwwvmtntyp3b7e&st=5hc5f3r1&raw=1,"Crisis, un problema de matémáticas ",ANAYA ,1962-01-28,"Mamá , ¿que es la crisis? Papá dijo que estábamos en crisis, parece algo muy terrible",Crisis,"Revista la voz, Colecciones Especiales Biblioteca de Humanidades Universidad Catolica de Chile",application/pdf,pdf,spa,234  28-01-1962,Educational use permitted,http://rightsstatements.org/vocab/InC-EDU/1.0/,,/objects/small/234.4_sm.jpg,/objects/small/234.4_sm.jpg,application/pdf,/objects/transcripciones/234.4t.md
"234.5

",voz_234_5,https://www.dropbox.com/scl/fi/zur65k9rziuc51cf8l32g/234.5.pdf?rlkey=dj2jkmnwjitmee8326dpllqan&st=hy8ibza3&raw=1,Sorteo de series: Chile apremiado,"Livingstone, Sergio",1962-01-28,"El salón ""Imperial"" del hortel Carrera, parecía la sala de sesiones de NU en un día de ajetreo intenso. Ese jueves 18 de enero de 1962, se llevaba a efecto la transcendental Ceremonia del sorteo de los equipos finalistas al campeonato mundial de fútbol. Cinco radios locales, diez del extranjero (incluso una de Venezuela), la UPI, la AP, empresas de televisión de Brasil, Alemania y Argentina filmando para sus respectivas estaciones, las cámaras de noticiaros de todas partes del globo, el choque al elevarse el murmullo de diez idiomas diferentes y una multitud de 400 personas donde cabían 200, hacían del hermoso salón donde se iba a llevar el sorteo, una verdadera torre de Babel ",Mundial de futbol,"Revista la voz, Colecciones Especiales Biblioteca de Humanidades Universidad Catolica de Chile",application/pdf,pdf,spa,234  28-01-1962,Educational use permitted,http://rightsstatements.org/vocab/InC-EDU/1.0/,,/objects/small/234.5_sm.jpg,/objects/small/234.5_sm.jpg,application/pdf,/objects/transcripciones/234.5t.md
"234.6
",voz_234_6,https://www.dropbox.com/scl/fi/twtq8ln0ojuw9r1bpbx4a/234.6.pdf?rlkey=dfxciajtreluyav7az5el9qki&st=lb6um3zt&raw=1,El Gigolo,"Vega, Alicia ",1962-01-28,"Con el famoso actor Jean-Claude Brialy, ""héroe"" de ""los primos"", se quiso hacer otra película adecuada a su ya indentificada figura de joven inútil de civilización actual ",Jean - Claude Brialy; héroe; primos,"Revista la voz, Colecciones Especiales Biblioteca de Humanidades Universidad Catolica de Chile",application/pdf,pdf,spa,234  28-01-1962,Educational use permitted,http://rightsstatements.org/vocab/InC-EDU/1.0/,,/objects/small/234.6_sm.jpg,/objects/small/234.6_sm.jpg,application/pdf,/objects/transcripciones/234.6t.md
236.P,voz_236_p,https://www.dropbox.com/scl/fi/gtlddcqjw6iv2r6e0vqic/236.-P.jpg?rlkey=mkteqly2ycpk5e67qrpfxh6jw&st=j50oo191&raw=1,Diario la voz N°236 11 de febrero de 1962,"Santibañes., Abraham",1962-02-11,,,"Revista la voz, Colecciones Especiales Biblioteca de Humanidades Universidad Catolica de Chile",Image;StillImage,image,spa,236  11-02-1962,Educational use permitted,http://rightsstatements.org/vocab/InC-EDU/1.0/,,/objects/small/236.p_sm.jpg,/objects/thumbs/236.p_th.jpg,Image;StillImage,
236.1 ,voz_236_1,https://www.dropbox.com/scl/fi/3wkmi3bfcy6m0heocbhyn/236.1.pdf?rlkey=6ff3f23dmwi2dn1m694y6wdv2&st=bnn3he1h&raw=1,El FRAP busca candidato. No por mucho madrugar...,"Rojas, Darío ",1962-02-11,"Aun siguren siendo perceptibles los movimientos internos derivados de la reciente reunión de cansilleres en Punta del Este y de la fluctuación experimentada por el dólar. Durante la semana ha continuado el debate político sobre esas materias. Y mientras esto ocurre, el FRAP comienza a prepararar sus cuadros electorales para la campaña presidencial, partiendo con vigosr y resolución de la campaña municipal del próximo año y reservando 1962 para ""mejorar el naipe"" y tentar alianzas que cree favorable.   Cancilleres; Punta del Este;  FRAP",Cancilleres; Punta del Este; FRAP ,"Revista la voz, Colecciones Especiales Biblioteca de Humanidades Universidad Catolica de Chile",application/pdf,pdf,spa,236  11-02-1962,Educational use permitted,http://rightsstatements.org/vocab/InC-EDU/1.0/,,/objects/small/236.1_sm.jpg,/objects/small/236.1_sm.jpg,application/pdf,/objects/transcripciones/236.1t.md
236.2,voz_236_2,https://www.dropbox.com/scl/fi/ah583kk23lk5bsvg00nhm/236.2.pdf?rlkey=3fmcbetk34jqw3z25u02tb2ww&st=01nnaov6&raw=1,"Concepcion, Valdivia, Puerto Montt.-  Tres caras de la reconstrucción ","Rojas, Darío ",1962-02-11,"Ni tanta ni tan poco es la reconstrucción que hemos podido ver en una semana de visita a tres ciudades de la zona damificada por los terremotos del año antepasado. Debe responder a un plan de inversiones de un volumen cercano a los ocho mil millones de pesos mensuales, lo que dará por resultado una reconstrucción a cinco años plazo, de acuerdo el plan estatal; evidentemente, hay vacíos que los sureños reclaman con vehemencia y que deben caer dentro de las probabilidades de ejecución del quinquenio programado.","Concepcion, Valdivia, Puerto Montt.-  Tres caras de la reconstrucción ","Revista la voz, Colecciones Especiales Biblioteca de Humanidades Universidad Catolica de Chile",application/pdf,pdf,spa,236  11-02-1962,Educational use permitted,http://rightsstatements.org/vocab/InC-EDU/1.0/,,/objects/small/236.2_sm.jpg,/objects/small/236.2_sm.jpg,application/pdf,/objects/transcripciones/236.2t.md
236.3,voz_236_3,https://www.dropbox.com/scl/fi/x2dojbuewkj0g1z4fecq7/236.3.pdf?rlkey=046qzlhcjsd5ttv2jslehgklq&st=byw6vudo&raw=1,Carbon: Incertidumbre y cesantía ,"Santibáñez, Abraham",1962-02-11,"En Llacolén, al otro lado del Bio - Bio, junto a los veraneantes que llenan de vida la cercana laguna de San Pedro y que se amontonan con curiosidad  junto a la Iglesia de Nuestra Señora de Calendaria (construída y planeada por empeñosos estudiantes de arquitectura), se inauguró el domingo pasado la Feria Exposición del Sur. Es la voz desafiante de Concepción que quiere decir que su gente está construyendo lo que les llevó el terremoto, y que quieren progresar más aún.",Llacolén; San Pedro; Candelaria; Concepción.,"Revista la voz, Colecciones Especiales Biblioteca de Humanidades Universidad Catolica de Chile",application/pdf,pdf,spa,236  11-02-1962,Educational use permitted,http://rightsstatements.org/vocab/InC-EDU/1.0/,,/objects/small/236.3_sm.jpg,/objects/small/236.3_sm.jpg,application/pdf,/objects/transcripciones/236.3t.md
236.4,voz_236_4,https://www.dropbox.com/scl/fi/nxl0vbysmcc74gi3qjh8m/236.4.pdf?rlkey=l8ygorzj3kfbhxunokpvb78wh&st=3vdna8hm&raw=1,No hay vidas acabadas ,RESSKA ,1962-02-11,Deseo contar la historia de una mujer sola... ¿Por qué? Porque hay muchas otras mujeres solas y ... ¿Y ...? Y para ellas Vianka descubrió un mundo nuevo ... Curioso nombre ése ... Vianka ... La historia es también curiosa. Cuéntela Ud.... ,Historia; Vianka; mujer; sola ,"Revista la voz, Colecciones Especiales Biblioteca de Humanidades Universidad Catolica de Chile",application/pdf,pdf,spa,236  11-02-1962,Educational use permitted,http://rightsstatements.org/vocab/InC-EDU/1.0/,,/objects/small/236.4_sm.jpg,/objects/small/236.4_sm.jpg,application/pdf,/objects/transcripciones/236.4t.md
236.5,voz_236_5,https://www.dropbox.com/scl/fi/rrwkepot59yhcsxf8gxtq/236.5.pdf?rlkey=0fo10kiaq1j704em5w4mqzv8d&st=njretdu4&raw=1,"Siempre hay que elegir, Claudia (si no sería muy aburrido)",ANAYA ,1962-02-11,"Papá, ¿hay que vivir eligiendo? Si Claudia. Creo que ya debías saberlo. Pero, papá, es todo tan difícil y complicado. ¿No querrás una vida simple, Claudia? No, sería una lata. En realidad, la peor lata del mundo. Pablo estaba serio cuando reprendió a Claudia:",Claudia; Pablo; elegiendo.,"Revista la voz, Colecciones Especiales Biblioteca de Humanidades Universidad Catolica de Chile",application/pdf,pdf,spa,236  11-02-1962,Educational use permitted,http://rightsstatements.org/vocab/InC-EDU/1.0/,,/objects/small/236.5_sm.jpg,/objects/small/236.5_sm.jpg,application/pdf,/objects/transcripciones/236.5t.md
236.6,voz_236_6,https://www.dropbox.com/scl/fi/tjsu7golbj55vfik08a56/236.6.pdf?rlkey=03w423jnar1xuli0j9dyw88pe&st=dnvdfjev&raw=1,Las plumas rojas de Estados Unidos,"Santos, Martín",1962-02-11,"Hasta 1957, el nombre de Howard Fast era anatema en Estados Unidos, y sus obras - algunas de ellas muy buenas - despertaban recelo a la gran masa de lectores ",Howard Fast; Estados Unidos; anatema.,"Revista la voz, Colecciones Especiales Biblioteca de Humanidades Universidad Catolica de Chile",application/pdf,pdf,spa,236  11-02-1962,Educational use permitted,http://rightsstatements.org/vocab/InC-EDU/1.0/,,/objects/small/236.6_sm.jpg,/objects/small/236.6_sm.jpg,application/pdf,/objects/transcripciones/236.6t.md
236.7,voz_236_7,https://www.dropbox.com/scl/fi/hl0cj0jenpieg8d3s26t9/236.7.pdf?rlkey=pznrptwfxaguusnp5i57le9zw&st=kp0w9nis&raw=1,Dejaron ilusiones y se llavaron variadas experiencias ,"Baltra, Lidia",1962-02-11,"Después de nueve meses de estada en Chile como estudiantes de la Universidad Católica, diez jóvenes norteamericanos regresaron a su país para continuar sus estudios en Asunto Interamericanos. Fue el tercer grupo (los primeros vinieron en 1959 y 1960) del programa ""Junior Year Abroad"" (segundo año universitario en el extranjero), que algunas universidades norteamericanas ofrecen a sus alumnos, para facilitar el estudio en el campo mismo de la especialidad de cada muchacho.",Chile; interamericanos; universidades.,"Revista la voz, Colecciones Especiales Biblioteca de Humanidades Universidad Catolica de Chile",application/pdf,pdf,spa,236  11-02-1962,Educational use permitted,http://rightsstatements.org/vocab/InC-EDU/1.0/,,/objects/small/236.7_sm.jpg,/objects/small/236.7_sm.jpg,application/pdf,/objects/transcripciones/236.7t.md
